[
  {
    "version": "v0.5.2-alpha",
    "subsystem": "chat_a",
    "stage": "alpha",
    "date": "2026-09-02",
    "spec_ref": "Spec 048",
    "title": "Chat A: 무환각 인용 검증 & 모바일 100dvh 가상 키보드 방어",
    "highlights": [
      "GroundednessSanitizer: 가상 사용자 패턴('사용자 A/B/C') 날조 0% 원천 차단 및 서술문 자동 치환",
      "StreamingTokenInterceptor: 청크 경계 금지어 쪼개짐(Flash of Forbidden Text) 방어용 캐리 버퍼 구현",
      "ProductLinkCard: 공식몰 파라미터 검증 완료 구조화 상품 링크 카드 연동",
      "visualViewport API: 모바일 가상 키보드 활성화 시 뷰포트 높이 실시간 동적 방어"
    ]
  },
  {
    "version": "v0.5.0-alpha",
    "subsystem": "chat_a",
    "stage": "alpha",
    "date": "2026-08-30",
    "spec_ref": "Spec 046",
    "title": "Chat A: FastAPI 경량 웹 전환 및 실시간 SSE 스트리밍",
    "highlights": [
      "무거운 Streamlit 전체 Re-run 구조에서 초경량 FastAPI + Vanilla JS SSE 스트리밍 웹 클라이언트로 전면 전환",
      "/api/v1/chat/stream SSE 엔드포인트 구축 및 토큰 단위 점진적 렌더링",
      "바텀 시트(Bottom Sheet) 원문 리뷰 팝업 및 마크다운 테이블 렌더러 탑재"
    ]
  },
  {
    "version": "v0.4.0-alpha",
    "subsystem": "chat_a",
    "stage": "alpha",
    "date": "2026-08-28",
    "spec_ref": "Spec 040",
    "title": "Chat A: 모바일 헤더 및 썸존(Thumb Zone) 인터랙션 최적화",
    "highlights": [
      "스마트폰 및 카카오톡 인앱 브라우저를 위한 상단 툴바 0px 잘림 방지",
      "1-클릭 카테고리 질문 칩바(스킨케어, 클렌징, 선케어 등) 가로 스크롤 UI",
      "48px 터치 타깃 및 스마트폰 한 손 조작성 강화"
    ]
  },
  {
    "version": "v0.3.5-alpha",
    "subsystem": "chat_a",
    "stage": "alpha",
    "date": "2026-08-25",
    "spec_ref": "Spec 038",
    "title": "Chat A: 제품 시리즈(Series) 식별 및 인라인 인용 태그 결속",
    "highlights": [
      "동일 브랜드 내 다수 라인업(예: 프로폴리스 앰플 vs 쿠션) 혼동 방지",
      "리뷰 순위별 [제품명 리뷰 N] 태그 강제 바인딩"
    ]
  },
  {
    "version": "v0.1.0-alpha",
    "subsystem": "chat_a",
    "stage": "alpha",
    "date": "2026-08-20",
    "spec_ref": "Spec 014",
    "title": "Chat A: 실시간 추론 단계(Step Event) 시각화 콜백 탑재",
    "highlights": [
      "사용자 질의 분석 중 검색·재정렬·문맥선별 진행 상태를 시각적으로 보여주는 아코디언 상태 박스 구축"
    ]
  },
  {
    "version": "v0.4.1-alpha",
    "subsystem": "chat_b",
    "stage": "alpha",
    "date": "2026-09-02",
    "spec_ref": "Spec 048",
    "title": "Chat B: 4단계 파이프라인 타임라인 & 레거시 IT 프롬프트 제거",
    "highlights": [
      "NO_THINK_SYSTEM_PROMPT 제거: 뷰티 분석가 전용 SSOT PersonaType.ANALYST 프롬프트 바인딩",
      "사실 극성 일치(Polarity Fidelity): 부정/회의적 리뷰 인용 시 왜곡 없는 객관적 한계점 보고",
      "Document Score Threshold UI: BGE 재정렬 점수 임계값(0.85) 및 Score Cliff(0.25) 실시간 슬라이더 연동"
    ]
  },
  {
    "version": "v0.3.0-alpha",
    "subsystem": "chat_b",
    "stage": "alpha",
    "date": "2026-08-27",
    "spec_ref": "Spec 039",
    "title": "Chat B: 제로 서치(Zero-Search) 글로벌 하드 블록 & 카테고리 회복",
    "highlights": [
      "DB 내 리뷰가 전혀 없는 품목 질의 시 허위 생성을 차단하고 유사 카테고리 인기 상품 추천 칩으로 안전하게 유도"
    ]
  },
  {
    "version": "v0.2.5-alpha",
    "subsystem": "chat_b",
    "stage": "alpha",
    "date": "2026-08-24",
    "spec_ref": "Spec 037",
    "title": "Chat B: 크로스 서비스 LLM 연동 & 인용 번호 초과(N > K) 방어",
    "highlights": [
      "컨텍스트 내 유효 리뷰 수(K)를 초과하는 날조 태그 자동 Pruning 및 4B 합성 모델 안정화"
    ]
  },
  {
    "version": "v0.2.0-alpha",
    "subsystem": "chat_b",
    "stage": "alpha",
    "date": "2026-08-22",
    "spec_ref": "Spec 030",
    "title": "Chat B: BGE-Reranker 파이프라인 최적화 & 점수 절벽 필터링",
    "highlights": [
      "BGE-M3 임베딩 및 Reranker 점수 급락(Cliff Delta 0.25) 구간 이후의 무관련 문맥 자동 배제 필터링 구현"
    ]
  },
  {
    "version": "v0.1.0-alpha",
    "subsystem": "chat_b",
    "stage": "alpha",
    "date": "2026-08-19",
    "spec_ref": "Spec 006",
    "title": "Chat B: RAG 브랜드 가드레일 & 실시간 2열 대시보드 런칭",
    "highlights": [
      "올리브영 3,062개 화장품 브랜드 엔티티 정규화 및 FastAPI 기반 고성능 하이브리드 RAG 챗봇 최초 런칭"
    ]
  },
  {
    "version": "v0.9.0-beta",
    "subsystem": "model_gateway",
    "stage": "beta",
    "date": "2026-09-02",
    "spec_ref": "Spec 048",
    "title": "Model Gateway: 4슬롯 Continuous Batching & 32K 컨텍스트 서빙",
    "highlights": [
      "RTX 3060 DEMO 모드: llama.cpp 단일 노드 안정화 서빙",
      "동적 헬스체크: 8081(LLM), 8090(Embedding), 8091(Reranker) 자동 복구 및 상태 모니터링",
      "연속 배치 슬롯 4개, 32K 컨텍스트 풀 및 OOM 방어 가드레일 완성"
    ]
  },
  {
    "version": "v0.8.5-beta",
    "subsystem": "model_gateway",
    "stage": "beta",
    "date": "2026-08-29",
    "spec_ref": "Spec 044",
    "title": "Model Gateway: 100% VRAM 온로드 & RAM 오프로드 방지 패치",
    "highlights": [
      "GPU 가속 레이어(-ngl) 풀 온로드 보장으로 시스템 RAM 오프로드로 인한 추론 지연을 0%로 제거"
    ]
  },
  {
    "version": "v0.6.0-beta",
    "subsystem": "model_gateway",
    "stage": "beta",
    "date": "2026-08-23",
    "spec_ref": "Spec 031",
    "title": "Model Gateway: GPU 큐 대기 타임아웃 확장 & 동시성 제어",
    "highlights": [
      "다중 사용자 접속 시 GPU 락 경합 방지를 위한 비동기 큐 관리자 및 사용자 대기 순번 알림(queue_status) 탑재"
    ]
  },
  {
    "version": "v0.1.0-beta",
    "subsystem": "model_gateway",
    "stage": "beta",
    "date": "2026-08-18",
    "spec_ref": "Spec 013",
    "title": "Model Gateway: Qwen 2.5 Multi-Tier 동적 라우팅 엔진",
    "highlights": [
      "경량 2B(의도분류/초고속 상담) 및 4B(심층 RAG 요약) 모델 티어드 라우팅 아키텍처 최초 수립"
    ]
  },
  {
    "version": "v0.8.5-beta",
    "subsystem": "nginx_gateway",
    "stage": "beta",
    "date": "2026-09-02",
    "spec_ref": "Spec 048",
    "title": "Nginx Gateway: SSOT 템플릿 렌더러 & /changelog 라우팅",
    "highlights": [
      "render_gateway_config.py: 환경변수 및 Pydantic 설정값 기반 자동 검증 렌더링",
      "try_files /changelog.html: 정적 체인지로그 100% 무중단 안정 서빙",
      "모바일 2x1 벤또 카드 1열 반응형 자동 변환 레이아웃 탑재"
    ]
  },
  {
    "version": "v0.8.0-beta",
    "subsystem": "nginx_gateway",
    "stage": "beta",
    "date": "2026-08-28",
    "spec_ref": "Spec 042",
    "title": "Nginx Gateway: B-Team 프로덕션 전환 & 서브패스 라우팅 정합",
    "highlights": [
      "/bteam/chata/, /bteam/chatb/, /bteam/oliview/ 서브패스 역방향 프록시 및 SSE 스트리밍 버퍼링 완전 해제"
    ]
  },
  {
    "version": "v0.7.0-beta",
    "subsystem": "nginx_gateway",
    "stage": "beta",
    "date": "2026-08-21",
    "spec_ref": "Spec 029",
    "title": "Nginx Gateway: JSON Analytics 액세스 로그 & Request-ID 추적",
    "highlights": [
      "전체 인입 트래픽에 대한 구조화 JSON 액세스 로깅 및 분산 지연시간(latency) 관측 체계 구축"
    ]
  },
  {
    "version": "v0.1.0-beta",
    "subsystem": "nginx_gateway",
    "stage": "beta",
    "date": "2026-08-17",
    "spec_ref": "Spec 002",
    "title": "Nginx Gateway: 독립 인프라 단일 진입점 개통",
    "highlights": [
      "외부 게이트웨이 및 역방향 프록시 연동 단일 진입점 개통"
    ]
  },
  {
    "version": "v0.8.0-beta",
    "subsystem": "oliview_web",
    "stage": "beta",
    "date": "2026-09-02",
    "spec_ref": "Spec 048",
    "title": "Oliview Web: 감정 속성 레이더 차트 & 인사이트 대시보드",
    "highlights": [
      "화장품 리뷰 5.7만 건 기반 5대 핵심 속성(보습, 순함, 제형, 발림성, 진정) 통계 분석 및 React UI 연동"
    ]
  },
  {
    "version": "v0.7.5-beta",
    "subsystem": "oliview_web",
    "stage": "beta",
    "date": "2026-08-27",
    "spec_ref": "Spec 041",
    "title": "Oliview Web: 풀스택 파이프라인 구조 재편 & Vite React 최적화",
    "highlights": [
      "Flask 백엔드 REST API와 React 프론트엔드 간 상태 동기화 및 번들 크기 경량화"
    ]
  },
  {
    "version": "v0.5.0-beta",
    "subsystem": "oliview_web",
    "stage": "beta",
    "date": "2026-08-20",
    "spec_ref": "Spec 011",
    "title": "Oliview Web: 브랜드별 상품 상세 페이지 & 리뷰 필터링 수정",
    "highlights": [
      "타사/자사 브랜드 상품 클릭 시 404 없이 상품 상세 스펙과 감성 분석 리포트를 즉시 열람하도록 라우팅 교정"
    ]
  },
  {
    "version": "v0.7.0-alpha",
    "subsystem": "core",
    "stage": "alpha",
    "date": "2026-09-02",
    "spec_ref": "Spec 048",
    "title": "Core: 마스터 bteam/oliview_core SSOT & SHA-256 동기화",
    "highlights": [
      "GroundednessSanitizer: 가상 사용자 정제 및 서브스트링 인용구 검증",
      "PromptPersonaAdapter: ChatA(컨시어지) / ChatB(애널리스트) 페르소나 어댑터",
      "Structured Logging: PII 마스킹 및 JSON 로깅 보안 계약 준수"
    ]
  },
  {
    "version": "v0.5.0-alpha",
    "subsystem": "core",
    "stage": "alpha",
    "date": "2026-08-23",
    "spec_ref": "Spec 021",
    "title": "Core: 프롬프트 인젝션 방어 & 조기 의도 게이트웨이",
    "highlights": [
      "탈옥(Jailbreak), 시스템 지시문 유출 공격 및 악의적 질의를 모델 호출 전 단계에서 차단하는 정규식/의도 가드레일 탑재"
    ]
  },
  {
    "version": "v0.4.0-alpha",
    "subsystem": "core",
    "stage": "alpha",
    "date": "2026-08-20",
    "spec_ref": "Spec 019",
    "title": "Core: Redis 분산 캐시 & 세션 토큰 인프라 구축",
    "highlights": [
      "반복 질의 임베딩/RAG 결과 Redis 캐싱으로 응답 지연시간 80% 단축 및 세션 상태 보존"
    ]
  },
  {
    "version": "v0.8.0-beta",
    "subsystem": "pilos",
    "stage": "beta",
    "date": "2026-09-02",
    "spec_ref": "Spec 048",
    "title": "PILOS: 주식 수급 감정 지수 분석 & AI 리포트 완성",
    "highlights": [
      "A-Team 종목별(SK하이닉스, 삼성전자 등) 뉴스 및 수급 데이터 감정 지수 계산, 실시간 큐레이션 및 AI 종합 리포트 서비스 완비"
    ]
  },
  {
    "version": "v0.7.0-beta",
    "subsystem": "pilos",
    "stage": "beta",
    "date": "2026-08-25",
    "spec_ref": "Spec 025",
    "title": "PILOS: 일일 증권 문서 증분 수집 & 동기화 파이프라인",
    "highlights": [
      "크롤러 수집 데이터 무결성 검증 및 일일 시장 뉴스 증분 배치 동기화 워커 프로세스 상시 가동"
    ]
  }
]
